{
  "schema_version": 1,
  "manifest_kind": "jawiki_research_top32_snapshot",
  "verification_status": "verified",
  "snapshot_date": "2026-08-01",
  "source_span_extractor_git_sha": "7cdb51f77875caab8be25683fc3bf174c0e91325",
  "source_span_content_sha256": "f06b747dfa4ec1b650696cd04f156071acde8bf543b5ba9fe94f6146123275c9",
  "dictionary_indexer_git_sha": "227ffe8a6b0b515c7f3cdf504b3d98b313360e53",
  "dictionary_index_content_sha256": "4a3b04ea02ec601a1b23eedd6eb4c19582cd36c39f098c2d0ad61b259fd6c072",
  "request_builder_git_sha": "a39d9e460ae6f28b73b4dee16fafcbb69e83ed45",
  "request_record_count": 1969,
  "request_content_sha256": "aed057119b2ba07b0d028b9e9040192cd132b93f7129ff1809261852b830a9b7",
  "request_report_sha256": "7a9c142bad0a695cc75a22a4cb6f123df324c9e11ec609f04b2cb651545d48e9",
  "exporter_identity_manifest_sha256": "2b99a6875f9cc374db13029f1f56cb0de6994168c7f1d4fbfb3cb3e5af3814b7",
  "exporter_git_sha": "06ff8c34417fb7dbc24e41d786dfb6434cdd6aa1",
  "exporter_binary_sha256": "0b26990a153df06c8e870b7e44abca386ada2ffd6f649c0232cea6a79960acbf",
  "sakura_input_head": "8e966dff456e4e7165e025f97c1f73327ff3f550",
  "dictionary_sha256": "6d34364b5354d3c67efefaf15b50142b1365b21140ec8eee0f77570d828544ad",
  "requested_limit": 32,
  "effective_converter_bound": 32,
  "user_dictionary_enabled": false,
  "record_count": 1969,
  "candidate_count": 35414,
  "search_exhausted_record_count": 1047,
  "truncated_record_count": 922,
  "content_sha256": "82bbea56bb1305f335799188a39c829a0aff52825d069744912cb9faa7bdee2d",
  "report_sha256": "fda998c4bfdbc448f1d19fcc9e37804be76c5dca7777d7254cd9cfbc315736aa",
  "reproduction_run_count": 2,
  "raw_text_in_manifest": false
}
